{
  "contract_version": "0.1",
  "kind": "gap",
  "event_id": "gap-1",
  "task_ref": {"kind": "task", "issuer_domain": "platform", "id": "t-123"},
  "run_ref": {"kind": "run", "issuer_domain": "stub", "id": "r-456"},
  "source_sequence": 7,
  "occurred_at": "2026-09-30T10:00:02Z",
  "received_at": "2026-09-30T10:00:02Z",
  "gap": {"from_sequence": 5, "to_sequence": 6}
}
