{
  "contract_version": "0.1",
  "kind": "event",
  "event_id": "evt-tool-result-1",
  "task_ref": {
    "kind": "task",
    "issuer_domain": "platform",
    "id": "t-123"
  },
  "run_ref": {
    "kind": "run",
    "issuer_domain": "backend-a",
    "id": "br-9001"
  },
  "source_sequence": 9,
  "occurred_at": "2026-10-01T08:02:00Z",
  "received_at": "2026-10-01T08:02:01Z",
  "payload_schema_ref": "https://example.com/schemas/create-ticket.output.schema.json",
  "payload": {
    "outcome": "business_rejected",
    "reason": "insufficient stock",
    "ticket_id": null
  },
  "correlation_id": "call-1"
}
