{
  "contract_version": "0.1",
  "kind": "event",
  "event_id": "evt-tool-unknown-1",
  "task_ref": {
    "kind": "task",
    "issuer_domain": "platform",
    "id": "t-123"
  },
  "run_ref": {
    "kind": "run",
    "issuer_domain": "backend-a",
    "id": "br-9001"
  },
  "source_sequence": 12,
  "occurred_at": "2026-10-01T08:03:00Z",
  "received_at": "2026-10-01T08:03:01Z",
  "payload_schema_ref": "https://example.com/schemas/tool-error.schema.json",
  "payload": {
    "outcome": "outcome_unknown",
    "tool": "create_ticket",
    "reconciliation": {
      "strategy": "query_by_idempotency_key",
      "key": "idem-001"
    }
  },
  "correlation_id": "call-2"
}
